문서번호,제목,질문,위치,조회수,질문날짜,답변ID,답변,답변날짜
476725350,"질문고척돔 주변 숙소추천해주세요","이번에 찰리푸스 내한을 가게됐는데 지방에 살아서 막차가 9시입니다ㅜ 그래서 숙박을 해야할거같아요 학생이라 돈도 많이 없어서 콘서트 비용만 해도 40가까이 되는데 저렴한 숙박시설이나 머무를수 있는곳 좀 알려주세요ㅜㅜㅜ 그리고 숙소 예약은 언제부터 해야할까요?","서울특별시 구로구 고척동 ",6,2024-10-17,NULL,NULL,NULL
476725014,"질문만약에 강남역에서 거지복장입고 구걸하면어떻게되나요?","혹시 경찰서로 끌려가나요? 궁금해서 물어봐요 법에 걸리나요?","서울특별시 강남역 ",8,2024-10-17,NULL,NULL,NULL
476724692,"질문서울 신림동 편의점 홍어","신림동에 있는 편의점 중에서 홍어를 파는 편의점이 있을까요? 예전에 편의점 홍어를 먹어봤는데 나름 괜찮더라구요. 인터넷에서 구매해서 먹기에는 양도 많고 가격도 좀 부담이고 그래서... 아시는 분 좀 알려주세요 ㅠㅠ","서울특별시 관악구 신림동 ",8,2024-10-17,NULL,NULL,NULL
476724480,"질문여의도 한강공원 주변","밤 산책으로 여의도 한강공원 가려고 하는데 그전에 주변?에서 놀고 싶은데 추천할 만한 곳이 있나요? 노량진 홍대 이런 곳들처럼요. 많이 알려진 곳들이요.","서울특별시 ",10,2024-10-17,NULL,NULL,NULL
476724043,"질문경복궁 야간개장 입장 꼭 예약하고 가야하나요??","경복궁 야간개장 꼭 예약하고 가야하나요?? 만약 그러면 야간말고 해 떠있을때라도 가고싶은데 야간개장 아니면 그냥 현장에서 결제햐도 되나요??","서울특별시 ",16,2024-10-17,4767240432,"개장은 꼭 예약해야되고 못했다면 한복입고가야 무료입장 가능합니다.주간관람은 현장 매표소에서 구매하면 되고요. 참고로 주간도 한복입고가면 무료입니다.",2024-10-17
476724043,"질문경복궁 야간개장 입장 꼭 예약하고 가야하나요??","경복궁 야간개장 꼭 예약하고 가야하나요?? 만약 그러면 야간말고 해 떠있을때라도 가고싶은데 야간개장 아니면 그냥 현장에서 결제햐도 되나요??","서울특별시 ",16,2024-10-17,4767240431,"은 예약을 꼭 해야 되고  평상시는 현장 결제해도 됩니다.",2024-10-17
476722460,"질문특성화고에서 일반고로 전학","지금 서울에 있는 특성화고에 다니고 있고 2학년으로 넘어가기 전에 전학을 갈 수 있나요? 가고싶은 일반고는 경기도에 있습니다. 가족 모두 경기도에 살고 있구요. 아마 겨울방학 끝나고 개학날이 25년 3월 3일인것 같은데 그 날부터 다닐수있는 방법은 없나요? 찾아보니 특성화고에서 일반고로 전학갈수 있는 기간이 3월 7일부터라는데 개학하고 중간에 가기에 너무 애매해서요ㅜㅜ 제발 알려주세요","서울특별시 ",17,2024-10-17,NULL,NULL,NULL
476721969,"질문홍대 애슐리 주말에 사람 많나요...??","일요일에 애슐리 홍대점에 가려고 하는데요... 오후 3시 ~ 4시쯤 가도 사람이 많을까요??? 그리고 제가 혼밥을 할 생각인데 일요일 오후에 저처럼 혼밥 하는 사람은 없겠죠?? 다 가족이나 연인 일까요???ㅠㅠ 쫌 뻘쭘할 것 같아서요ㅠㅠ","서울특별시 홍대입구 ",10,2024-10-17,NULL,NULL,NULL
476721281,"질문서울역은 출구가 몆개인가요",,"서울특별시 ",14,2024-10-17,4767212812,"선 10군데4호선 5군데경의중앙선 1군데공항철도 1군데기차 3군데",2024-10-17
476721281,"질문서울역은 출구가 몆개인가요",,"서울특별시 ",14,2024-10-17,4767212811,곳,2024-10-17
476721242,질문신비아파트...,"신비아파트 굿즈 어디서 팔아요? (사진 있음)","서울특별시 ",11,2024-10-17,NULL,NULL,NULL
476721152,"질문한강의 발원지는 어딘가요?...","한강의 발원지는 어딘가요? 궁금해서요.","서울특별시 용산구 한강로 ",15,2024-10-17,4767211522,"도 태백 검룡소입니다.",2024-10-17
476721152,"질문한강의 발원지는 어딘가요?...","한강의 발원지는 어딘가요? 궁금해서요.","서울특별시 용산구 한강로 ",15,2024-10-17,4767211521,"의 발원지는 검룡소입니다.",2024-10-17
476721148,"질문서초 삼성타운 B동도 삼성 소유인가요?",,"서울특별시 강남역 ",15,2024-10-17,NULL,NULL,NULL
476719635,"질문출근 가까운곳vs먼곳","30분 내외 거리 출퇴근 - 350받기 2시간 내외 거리 출퇴근 - 470 받기 어느 곳 다니냐 둘다 11시간정도 근무","서울특별시 ",11,2024-10-17,4767196351,"건 먼곳 470",2024-10-17
476719561,"질문킹키부츠 밤공 끝나는 시간","끝나고 버스타서 경부고속으로 가야하는데 11시 버스 탈 수 있을까요?","서울특별시 용산구 ",10,2024-10-17,4767195611,"시간 이 19시 시작해서  2시간 35분 정도 되는거 같은데여유 있게 갈수 있음블르스퀘어 6호선 한강진역  ~~  고속터미널역 까지 19분",2024-10-17
476716189,"질문서울 재개발 내 상가주택 분양권 문의","서울 재개발 지역내 3층 상가주택입니다. 재개발시 어떤 분양권을 받을 수 있을지 궁금합니다. 토지면적 128 주택근린생활시설 연면적 161 1층   근린생활시설(소매점) 65 2층   주택(2가구) 54 3층   주택(1가구) 42 옥탑  (연면적제외) 5 1. 아파트1 2. 아파트1 상가1 3. 아파트1+1 1은 최소 가능한 것으로 보이고 2 3번이 가능한지 궁금합니다.","서울특별시 ",13,2024-10-17,NULL,NULL,NULL
476715181,질문도와주세요,"금요일날 현체를 가는데 현체 끝나고 제 친구들이랑 만나기로 했는데 제 3명의 친구중 저는 홍대 다른 친구는 어린이 대공원 또 한명은 건국대에 있어서 중간에서 만나기로 했는데 어디서 만나야 할지 모르겠네요 아시는분 도와주세요","서울특별시 ",20,2024-10-17,4767151811,"로입구역 명동이 가장 좋은곳을지로 입구역8번 출구 바로앞 롯데백화점 연결통로스타 애비뉴 (연예인 bts 사진 손도장 등 포토존으로 유명 ) 롯데앞명동지하상가로 차 길 건너면 명동 을지로 초입명동 세계 길거리 음식 탕후루 등 (길거리 음식은 16시 이후에 많이 나옴)명동성당 옆골목이 맛집(명동교자등 ) 노래방 보세옷 등 놀 거리가 많은 곳명동역 쪽으로 나옴 명동역 지하상가 안 굿즈샵 1번 출구 12층짜리 다이소3번 출구 퍼시픽호텔 갈림길 좌측 재미로 끝까지 올라가면 남산돈까스 거리 (소월로)명동역 4번 출구 직진 신세계 사거리 좌측 애니메이션 센터 1층 애니까페 2층 놀이방애니센터에서 터널 방향으로 조금 올라가면 오르미라는 에스컬레이터 장치 무료남산타워 케이블카타는곳 까지 올라감명동은 물가가 비쌈 저렴한분식류등촌샤브샤브 칼국수 1명동교자 칼국수 1신세계떡복이두끼 떡복이 학생 1이베달라붙는떡복이 1",2024-10-17
476714666,"질문예비고3 부산에서 서울로 올라가서 공부","안녕하세요 부산에 살고 있는 고2 여학생입니다 제가 지금 다니는 학교에서 친구들이랑도 엄청 크게 싸워서 친구도 없는 것 같이 느껴지고 수시도 6점대여서 엄청 망했는데 좋은 대학을 가고 싶어합니다. 그래서 원래 제 계획은 자퇴를 하고 1년 혼자 학원을 다니면서 공부만 하려고 했습니다. 근데 요즘 드는 생각이 경기도에 이모네가 사는데 거기로 차라리 전학을 가서 거기서 살면서 공부할까라는 생각도 듭니다. 솔직히 경기도가 부산 저희 동네보단 훨씬 학구열도 높을 것 같고 솔직히 제가 이 동네에 너무 있기가 싫기도 해요… 자퇴를 한다고 해서 친구들을 안 마주치는 것도 아니고… 그런데 솔직히 이모네 가면 엄청 눈치도 보일테구… 정말 고민이 많아요ㅠ 해결책이 있을까요??ㅠㅠ 도와주세요ㅠㅠㅠ","서울특별시 ",15,2024-10-17,4767146661," 자퇴 후 이것도 저것도 안될 경우를 생각해야 되므로경기도로 전학 가는 걸 추천눈치가 보여도 잠깐이지 최소한 고졸 학벌은 만들어 놔야 함",2024-10-17
476714600,"질문예술의전당 지하 인춘아트홀 대관료...","예술의전당 지하 인춘아트홀 대관료는 얼마인가영?? 홈페이지에 없어서요!","서울특별시 서초구 서초동 ",11,2024-10-17,NULL,NULL,NULL
476714577,"질문가산디지털단지역 포장마차 운영","가산디지털단지역 주변에 포장마차가 있다고하던데 아직운영하나요~? 위치는 어디쯤일까요???","서울특별시 금천구 가산동 ",13,2024-10-17,4767145771,"디지털단지역 주변에는 포장마차가 운영되고 있는 곳이 있습니다. 주로 **가산디지털단지**의 번화가나 인근 골목에서 찾아볼 수 있습니다. 특히 **가산디지털단지 1번 출구** 근처나 **가산역 근처 골목**에서 포장마차가 있는 경우가 많습니다.운영 여부는 계절이나 시간대에 따라 달라질 수 있으므로 가기 전에 확인하는 것이 좋습니다. 최신 정보는 지역 주민의 후기를 참고하거나 직접 방문해 보는 것이 가장 확실합니다!답변이 되셨다면 채택부탁드립니다.",2024-10-17
476714282,"질문내신만 보면 염광이 나아요 월계가 나아요?","공부 못하는 중 3인데 솔직히 거기서 거기겠지만 그나마 분위기 좋고 내신 잘 딸수있는데는 어디예요?","서울특별시 노원구 ",13,2024-10-17,NULL,NULL,NULL
476713511,"질문노원구 염광고 월계고 어디갈까요","진짜 너무 고민되는데요ㅠㅠ 염광이 월계보다 내신수준이 더 어렵나요? 중 3인데 염광보다 월계가 더 대학 잘보낸다그러고 제가 중 3인데 공부를 못해서 고민되요 ㅠ 염광이 월계보다 더 나은줄 알았는데 아닌가요? 공부 못해서 내신따려고 고등학교가면 염광이 나아요 ?월계가 나아요?","서울특별시 노원구 ",13,2024-10-17,4767135111,"고등학교가 염광고등학교보다 명성과 대학 진학률이 높습니다. 내신 수준은 염광이 더 높지만 공부가 어렵다는 것은 아닙니다. 대학 진학을 목표로 한다면 월계를 권하지만 내신을 따르기 위해서는 염광이 더 나은 선택입니다.",2024-10-17
476704145,"질문서울에서 규모가 큰 찜질방 추천","서울에서 규모가 큰 드래곤 힐스파 같은 곳 추천해주세요 (서울보다 규모가 큰 곳이 있다면 그곳 추천해 주세요)","서울특별시 ",15,2024-10-17,4767041451,"닝시티 스파렉스",2024-10-17
476703801,"질문대구한남미용정고보 수련원같은거 안가나요??","중3인데 학남 수련원이나 수학여행 안간다고 해서요ㅜㅜ 진짜 안가나요??","서울특별시 용산구 한남동 ",12,2024-10-17,NULL,NULL,NULL
476703045,"질문목동 학군지 순위","목동은 유명 학군지 안에서 몇 등 정도 하나요 1티어가 대치 쪽인 것은 압니다","서울특별시 양천구 목동 ",11,2024-10-17,4767030451,동중계동목동순,2024-10-17
476702990,"질문홍대입구 전시회 추천해주세요","이왕이면 사진 촬영 가능하면 좋지만 아니어도 괜찮습니다 친구랑 홍대 놀러가는데 홍대 주변에 괜찮은 전시나 미술관 있을까요? 가까운 것들 위주로 추천 부탁드려요! 19일날에 갈 예정입니다","서울특별시 홍대입구 ",12,2024-10-17,4767029902,"홍대 상상마당 추천  합니다 무료 입니다2.또한  여러가지 이벤트 . 행사 자주 합니다",2024-10-17
476702990,"질문홍대입구 전시회 추천해주세요","이왕이면 사진 촬영 가능하면 좋지만 아니어도 괜찮습니다 친구랑 홍대 놀러가는데 홍대 주변에 괜찮은 전시나 미술관 있을까요? 가까운 것들 위주로 추천 부탁드려요! 19일날에 갈 예정입니다","서울특별시 홍대입구 ",12,2024-10-17,4767029901,"입구역 2호선서울특별시 마포구 양화로 160 홍대입구역청춘마루서울특별시 마포구 홍익로 18홍문관서울특별시 마포구 와우산로 94 학교법인홍익학원상상마당서울특별시 마포구 어울마당로 65 상상마당빌딩홍대에 괜찮은 무료 미술관 들이 많음홍대입구역 9번출구 골목 들어가서우측 으로 조금가면 메인거리 사거리좌측 국민은행  청춘마루여기서 홍대정문이 보임  정문건물 홍문관   비트겔러리메인거리 끝 상상마당 상설전시 무료  기획전시 유료",2024-10-17
476701414,"질문안양에서 서울 성동구를 가려고 하는데","안양역에서 지하철 이용해서 서울 성동구로 가는 방법좀 알려쥬새요","서울특별시 성동구 ",16,2024-10-17,4767014143,"구 구간 빨간색",2024-10-17
476701414,"질문안양에서 서울 성동구를 가려고 하는데","안양역에서 지하철 이용해서 서울 성동구로 가는 방법좀 알려쥬새요","서울특별시 성동구 ",16,2024-10-17,4767014142,"역에서 1호선 광운대행을 타고 용산역하차용산역에서 경의중앙선 지평행을 타고 왕십리역하차",2024-10-17
476701414,"질문안양에서 서울 성동구를 가려고 하는데","안양역에서 지하철 이용해서 서울 성동구로 가는 방법좀 알려쥬새요","서울특별시 성동구 ",16,2024-10-17,4767014141,"역에서 1호선 광운대행을 타고 용산역하차용산역에서 경의중앙선 지평행을 타고 왕십리역하차",2024-10-17
476700493,"질문당산역 근교 가볼만한곳 추천부탁드립니다~","당산역 근처에서 데이트예정인데 망리단길 망원시장 홍대거리 가봤고 근처 놀거리 먹거리 추천좀 부탁드려요~","서울특별시 영등포구 당산동 ",17,2024-10-17,4767004933,"역 2호선서울특별시 영등포구 당산로 229선유도공원서울특별시 영등포구 선유로 343 선유도공원당산역 4번출구 한강공원 쪽으로 와서 양화대교 엘레베이터 타고 올라간후선유도 공원 한강라면 한강자전거 돗자리 배달음식",2024-10-17
476700493,"질문당산역 근교 가볼만한곳 추천부탁드립니다~","당산역 근처에서 데이트예정인데 망리단길 망원시장 홍대거리 가봤고 근처 놀거리 먹거리 추천좀 부탁드려요~","서울특별시 영등포구 당산동 ",17,2024-10-17,4767004932," 당산역 근처에는 볼거리나 즐길 거리는 없습니다.2.구름 다리를 건너면 바로 한강 공원입니다. 선유도 공원까지데이트 코스로 적합합니다.",2024-10-17
476700493,"질문당산역 근교 가볼만한곳 추천부탁드립니다~","당산역 근처에서 데이트예정인데 망리단길 망원시장 홍대거리 가봤고 근처 놀거리 먹거리 추천좀 부탁드려요~","서울특별시 영등포구 당산동 ",17,2024-10-17,4767004931,"입구역 ~상수역 라인 추천 합니다1.명소 입니다축제거리예술거리클럽거리벽화거리땡땡거리버스킹 광장경의선 숲길상상마당와우산 둘레길2.장소 입니다방탈출카페보드게임카페타로카페애견카페고양이카페만화카페심리카페메이드카페볼링장포켓볼탁구장스크린야구스크린사격인생네컷인형뽑기방",2024-10-17
476699778,"질문홍대사주 실력좋은 분","생각했던것과는 다르게 요즘 일도 잘 안풀려서요. 내년이면 삼재라고 하는데 이것도 맘에 좀 걸리고... 답답한 마음에 홍대사주 잘 봐주는곳 있으면 한 번 가보려고 해요. 예약하고 1년 이상 기다려야하는 그런 곳 말고 비교적 빠르게 볼 수 있으면서 실력도 좋은 선생님 있으시면 말씀 좀 부탁드리겠습니다 좀 도와주세요 ㅜ","서울특별시 마포구 동교동 ",13,2024-10-17,4766997782,"에 사주 볼 수 있는 사주카페라던지 철학관은 많이 있지만유독 뛰어나게 사주를 잘보는 곳은 아직 찾지 못했어요사람마다 생각하는 기준이 모두 다 다르겠지만 저는홍대에 있는 철학관보단 사주나루에서 전화로 사주 봤었던우암이라는 선생님이 더 인상깊었네요....솔직히 말하면 사주풀이 실력은 다른 곳과 크게 다르지 않았어요.아무래도 사주라는게 학문을 기반으로 봐주는거다보니 오히려다른게 더 이상한 거겠죠....제가 인상깊었던건 같은 말을 하더라도 제가 알아듣기 쉽게잘 풀어서 설명해줬다는 점인데 이건 말로 설명하기 어렵고..직접 체감을 해보시는게 이해가 더 빠를거에요",2024-10-17
476699778,"질문홍대사주 실력좋은 분","생각했던것과는 다르게 요즘 일도 잘 안풀려서요. 내년이면 삼재라고 하는데 이것도 맘에 좀 걸리고... 답답한 마음에 홍대사주 잘 봐주는곳 있으면 한 번 가보려고 해요. 예약하고 1년 이상 기다려야하는 그런 곳 말고 비교적 빠르게 볼 수 있으면서 실력도 좋은 선생님 있으시면 말씀 좀 부탁드리겠습니다 좀 도와주세요 ㅜ","서울특별시 마포구 동교동 ",13,2024-10-17,4766997781,"월일시가 없습니다답글 채택하고 질문사항생년월일시 이메일 보내오면맛보기 사주팔자 감명 이메일 발송 합니다dosa7783@daum.netDaum이용자 선택권을 강화한 뉴스 세상의 모든 정보를 연결하는 검색. Daum에서 나의 관심 콘텐츠를 즐겨보세요.daum.net답글 채택하고질문사항음양력 구분생년월일시 첨부해서이메일 보내오면내일모레까지사주팔자 중요 포인트이메일 발송 합니다 (무료)dosa7783@daum.net채택과 포인트 기부는기본 매너입니다참조하시고 대발하기바랍니다!",2024-10-17
476699320,"질문잠실에 짐짐봉? 진진봉에대해 말하던데 이런데가 있나요?","안녕하세요 얼마전에 제가 좋아하는 해외 모 아티스트분을 길가에서 마주치게 됬는데 거기가 잠실 롯데타워 근처였거든요? 얘기 좀 나누다 그분들이 (당연히 영어로) 무슨 짐짐봉? 진진봉 이런얘기하던데 하필 그부분만 뭔말인지 정확히 못알아들어서 ㅜㅜ맥락으론 거기 간다는뜻같았는데 진짜 갈수록 너무 알고싶어서그런데 인터넷쳐도 안나오더라고요 짐짐봉 비슷한거라도 추측되는거 있는지요 궁금햐죽겠습니다ㅜㅜㅜ","서울특별시 송파구 잠실동 ",10,2024-10-17,NULL,NULL,NULL
476697850,"질문홍대 인스타 아이디 달라고 하는 남자","홍대에서 어떤 남자가 갑자기 다가와서 몇 살이냐고 묻고 어디에 살고 무슨 직업이냐고 물어보고 옆에 붙어서 제 폰을 가져가서 본인 계정 인스타 팔로우 하고 저한테 맞팔이 왔는데 신종 사이비인가요...? 맞팔 안 받아주는 게 낫겠죠 두 명이나 그러던데 정보 털리거나 해킹 당하거나 그러진 않겠죠? 제가 거절을 잘 못 해서... 그냥 줘버렸어요...","서울특별시 홍대입구 ",12,2024-10-17,NULL,NULL,NULL
476696609,"질문서울구로구개봉로1길118 엘리베이터 있나요?","제가 곧 전세가 만기라서 새로 이사 갈 집을 알아보고 있는데요 서울 구로구 개봉로 1길 118이 투룸이라고 해서 관심을 갖고 있습니다. 비교적 신축이던데 혹시 이 집 엘리베이터 있나요?","서울특별시 구로구 ",19,2024-10-17,4766966091,"뷰로 확인을 해보니 빌라로 보입니다건물은 5층인데요 보통 빌라는 엘리베이터시설이 없습니다엘리베이터가 있으면 공동관리비때문에 설치를 잘 안합니다그래도 혹시 모르니까 소개를 한 부동산에 문의해보세요...",2024-10-17
476695489,"질문김포에서 건국대 서울캠 통학","김포 어느 지역이  건국대 서울캠 통학 하는게 쉬울까요...? 통학시간 대략 1시간 30은 잡고 있어요ㅜ","서울특별시 ",17,2024-10-17,4766954892,"간30분 까지 본다면 주위환경 까지 생각 하는것으로 보임김포에서 괜찮은 지역은 구래역",2024-10-17
476695489,"질문김포에서 건국대 서울캠 통학","김포 어느 지역이  건국대 서울캠 통학 하는게 쉬울까요...? 통학시간 대략 1시간 30은 잡고 있어요ㅜ","서울특별시 ",17,2024-10-17,4766954891,"역 근처에서 통학하는것 추천합니다",2024-10-17
476694750,"질문사당 송별회 룸 1차2차 괜찮은곳 알려주세요. ㅠㅠㅠ","안녕하세요 저의 직장 동료 송별회를 하려고하는데요 사당 쪽으로 룸 으로된 괜찮은 1차2차 알려주세요 인원은 6~8명 입니다 조용하게 저희끼리 놀고싶어서요 ㅜㅜ 감사합니다~!!!!!!!!!!!!!! ###### 광고는 신고할거에요 #########","서울특별시 동작구 사당동 ",10,2024-10-17,NULL,NULL,NULL
476694403,"질문종로포장마차 몇시까지","종로포장마차 새벽까지 하나요?","서울특별시 종로구 종로 ",14,2024-10-17,4766944032,"시 ~ 4시저녁 17시쯤 되면 여기저기서  리어커 끌고 나옴4시까지 영업",2024-10-17
476694403,"질문종로포장마차 몇시까지","종로포장마차 새벽까지 하나요?","서울특별시 종로구 종로 ",14,2024-10-17,4766944031," 3시 까지 영업하는 곳이 많습니다",2024-10-17
476694046,"질문영등포 김안과 김주연 교수님 어디 병원에서 진료하실까요","안녕하세요. 영등포 김안과 김주연 교수님 어디 병원에서 진료하실까요? 예정에 치료를 잘 해 주셔서 다시 한번 찾아뵈려고 합니다. 다른 병원으로 가셨다고 ...","서울특별시 영등포구 ",12,2024-10-17,4766940461," 그런 질문을 병원을 통해 알아보기 바랍니다. 다른 곳에서는알아보기 어렵습니다.",2024-10-17
476560958,"질문종로3가역 게이들","종로3가역 근처 어느상가에 게이들이 많이 찾아오나요?","서울특별시 종로구 종로 ",24,2024-10-17,4765609581,"하는게이들은  낙원상가요",2024-10-17
476562836,질문동서울터미널역,"2024년 현재도 혹시 동서울터미널역 남자화장실에 칸막이에 구멍(글로리홀) 뚤려있나요?","서울특별시 강남역 ",27,2024-10-17,4765628362,"울터미널역(강변역)에는 시설물관리하는 사람들이 수시로확인하기때문에 남자화장실 칸막이에 구멍(글로리홀) 뚤려있는곳이 없습니다...",2024-10-17
476562836,질문동서울터미널역,"2024년 현재도 혹시 동서울터미널역 남자화장실에 칸막이에 구멍(글로리홀) 뚤려있나요?","서울특별시 강남역 ",27,2024-10-17,4765628361,"실 칸막이 구멍 었습니다",2024-10-17
476692576,"질문서울에 집값 싼 데가",어딘가요?,"서울특별시 ",19,2024-10-17,4766925764,"년말아파트 기준 4억 ~ 5억( 공통점 산동네 지은지 30년 지하철역 에서 마을버스이용20분 정도 소요  도보 등산수준 아파트주변 주택은 더쌈)1위 도봉동 도봉동 서울가든 도봉산역2위 은평구 신사동 라이프가든 새절역3위 관악구 신림동 현대아파트 관악산역4위 도봉구 방학동 우성아파트 쌍문역5위 서대문구 홍은동 극동아파트 홍제역",2024-10-17
476692576,"질문서울에 집값 싼 데가",어딘가요?,"서울특별시 ",19,2024-10-17,4766925763,"래도 중심지가 아닌 변두리쪽에 있는 동네가 저렴하지 않을까요...",2024-10-17
476692576,"질문서울에 집값 싼 데가",어딘가요?,"서울특별시 ",19,2024-10-17,4766925762," 싼곳 입니다도봉구 도봉동중랑구 망우동관악구 대학동. 난곡동. 난향동금천구 시흥동강서구 신월동",2024-10-17
476692576,"질문서울에 집값 싼 데가",어딘가요?,"서울특별시 ",19,2024-10-17,4766925761,"구 창동",2024-10-17
476692360,"질문강남파티룸강남퍼펙트 예약 방법과 가격은?","친구들과 함께 파티를 하기 위해 강남 파티룸 강남 퍼펙트를 예약하려고 하는데 예약 방법과 가격이 궁금합니다. 그리고 파티룸 내부 시설과 이용 후기도 함께 알려주시면 감사하겠습니다.","서울특별시 강남구 ",10,2024-10-17,NULL,NULL,NULL
476692022,"질문코엑스 팝업!?","2024년도 10월 23일에 서울 코엑스 아니면 코엑스 주변 10분 거리에서 팝업 하는거 있나요","서울특별시 ",12,2024-10-17,4766920221,"월 코엑스삐아20주년 팝업스토어집이없어 팝업스토어",2024-10-17
476521473,"질문강서구 화곡동 시간제 알바없나요?","새벽에하는5시간짜리알바 구해요 일을해하는데 지금 1톤탑차로. 배달하거든요 그런데너무힘들어서 집주위로와서 차 안막히는시간데에 알바하고시ㅃ어요 도와주세요","서울특별시 강서구 ",19,2024-10-17,NULL,NULL,NULL
