문서번호,제목,질문,위치,조회수,질문날짜,답변ID,답변,답변날짜
476645965,"질문대중교통 이전에는 무엇을 했나요?",,"서울특별시 ",19,2024-10-15,4766459651,"서울의 첨단 교통수단 전차옛 서울의 첨단 교통수단 전차love.seoul.go.kr전차입니다.",2024-10-15
476645797,"질문연남동에서 모임하려고 하는데 괜찮은 맛집 추천해주세요","연남동에서  모임하려고 하는데  모임 적당한 맛집없을까요?","서울특별시 마포구 연남동 ",18,2024-10-15,4766457971,"에 연남동에 있는 미담 연남점 추천드립니다예약도 가능히고음식도 맛있고 분위기 좋아요강추드립니다미담 연남점서울특별시 마포구 성미산로29안길 25 2층",2024-10-15
476645613,"질문강동구 9개월동안 살만한곳","제가 9개월간 천호역 근처 학원좀 다니려고하는데 근처 엄청 싼곳 없을까요? 30분거리까지 괜찮은데 집이 수원이라...","서울특별시 강동구 ",19,2024-10-15,4766456131,"구 쪽은 싼곳은 없고 30분 거리면 중랑 광진구  쪽면목 용마산 중곡",2024-10-15
476644628,"질문신림에서 다닐만한 괜찮은 스터디카페 알려주세요","신림에서 다닐만한 괜찮은 스터디카페 알려주세요 장소는 대학동이고 서울대벤처역 가까웠으면 좋겠습니다","서울특별시 관악구 신림동 ",14,2024-10-15,NULL,NULL,NULL
476644088,질문어디인가요?...,어디인가요?,"서울특별시 동작구 노량진동 ",20,2024-10-15,4766440881,"짱 노량진3호점서울특별시 동작구 노량진로14가길 15레알짱입니다.",2024-10-15
476554774,"질문개포동 구룡지하차도 양방향 입구에 과속카메라 있나요??","개포동 1277 네비에는 안떠있었는데 입구에 카메라가 있더라구요 보통 과속카메라는 옆에 단속중이라고 표지판도 있는데 없어서 그렇다고 차량수집장치라고도 안써있어서 질문합니다","서울특별시 강남구 개포동 ",27,2024-10-15,NULL,NULL,NULL
476640926,"질문경부선 만남의 광장 회차로?","경부고속도로 만남의 광장 서울방향 회차로(토끼굴)에 현대 쏠라티 차량 통과가 가능한지요? 아시는분 답변해주시면 감사드리겠습니다 _()_","서울특별시 광진구 광장동 ",21,2024-10-15,4766409262,"만남의광장 이영자맛집 말죽거리국밥 또먹을래나들이의 시작 경부고속도로 만남의 광장 빨리 도착하고 싶은 마음에 보통 첫 출발점인 경부고속도로의 만...m.blog.naver.com사진에 보면은 3.3m라고 언급되어있는데요쏠라티 높이가 2m가 안될겁니다.<높이 측정 추정은 이렇게 했어요>인터넷에 쏠라티 실내 천장 높이가 1928mm 정도 라고 합니다.단위계산으로 해보니 1.928m정도 됩니다.",2024-10-15
476640926,"질문경부선 만남의 광장 회차로?","경부고속도로 만남의 광장 서울방향 회차로(토끼굴)에 현대 쏠라티 차량 통과가 가능한지요? 아시는분 답변해주시면 감사드리겠습니다 _()_","서울특별시 광진구 광장동 ",21,2024-10-15,4766409261," 쏠라티 차량 통행 가능 합니다",2024-10-15
476639884,"질문강납 압구정 성형","강남이나 압구정가면 코 수술하고 부목붙이고나 그러신분들 많은가요? 지나가다보면 막 수술하고 나온분들 많나요?","서울특별시 강남구 ",20,2024-10-15,4766398842,"아니요 역  주변 그렇게 많지 않습니다2.그러나 성형 외과 주변 병원 주의에는 볼수 있습니다",2024-10-15
476639884,"질문강납 압구정 성형","강남이나 압구정가면 코 수술하고 부목붙이고나 그러신분들 많은가요? 지나가다보면 막 수술하고 나온분들 많나요?","서울특별시 강남구 ",20,2024-10-15,4766398841,"많습니다.. 특히 중국분들이많아요",2024-10-15
476639475,"질문서면역에서 부산대역까지","서면역에서 내리고 아무 출구나 갔다가 다시 들어간다고 치면 몇번 출구로 들어가야하나요?부산역 방면으로 가야될지 헷갈려유 ㅠ","서울특별시 강남역 ",18,2024-10-15,4766394751,"하세요서면역 들어가서 표를 사고 부산대 방면으로 지하철을 타면 됩니다.9정거장 약 20분 걸립니다.",2024-10-15
476639300,"질문서울 성동구 유기견 봉사","할곳 좀 알려주세요 유기견 봉사하고싶은데 서울쪽에 없어서 좀 알려주세요","서울특별시 성동구 ",18,2024-10-15,NULL,NULL,NULL
476637997,"질문발산역 다이소...","발산역 다이소에 엘리베이터있나요?","서울특별시 강남역 ",17,2024-10-15,4766379971,"하세요엘리베이터가 있습니다.https://blog.naver.com/PostView.naver?blogId=and_gromit&logNo=223093902229[발산] 큰 다이소를 찾는다면 다이소 발산역점발산역 사거리에 있는 3층짜리 다이소 발산역 6번 출구로 나오면 바로 보입니다 영업시간 10:00 ~ 22:00 주...blog.naver.com",2024-10-15
476637831,"질문서울 장소 찾아주세요 ㅠㅠ","제가 이번년도 초에 서울에서 실내데이트 코스를 찾다가 수원 AK 프라자같이 큰 건물안에 식당같은것들 모아져있는 곳을 발견했었는데 어딘지 도저히 찾아도 나오질 않네요 ㅠㅠ 코엑스 스타필드 이런곳은 아니였어요 ㅠㅠ 방배동 근처였던것같고 되게 크고 이런저런 식당이 많이있었어요 방배역 근처에 가까웠던걸로 기억해요","서울특별시 ",24,2024-10-15,4766378312,럴시티,2024-10-15
476637831,"질문서울 장소 찾아주세요 ㅠㅠ","제가 이번년도 초에 서울에서 실내데이트 코스를 찾다가 수원 AK 프라자같이 큰 건물안에 식당같은것들 모아져있는 곳을 발견했었는데 어딘지 도저히 찾아도 나오질 않네요 ㅠㅠ 코엑스 스타필드 이런곳은 아니였어요 ㅠㅠ 방배동 근처였던것같고 되게 크고 이런저런 식당이 많이있었어요 방배역 근처에 가까웠던걸로 기억해요","서울특별시 ",24,2024-10-15,4766378311,"하세요사당역 파스텔시티를 말하는 것 같습니다.층별로 다양한 식당이 있습니다.https://blog.naver.com/PostView.nhn?blogId=pastelcm&logNo=220158373377파스텔시티 : 사당역 파스텔시티 층별안내 매장 소개 및 영업시간 안내파스텔시티에 오신 것을 환영합니다~ 파스텔시티에 어떤 브랜드 들이 있는지 ...blog.naver.com",2024-10-15
476637693,"질문서울신림동에서 광주유스퀘어버스터미널","고속버스택배로 보내는데 서울 어디서 보내야되나요ㅠㅜ","서울특별시 관악구 신림동 ",16,2024-10-15,4766376932,"터미널역 호남선 센트럴시티터미널터미널 안에 들어가면 수화물 이라고 써있는곳이 보임돈내고 접수하면  도착시간 번호 적힌 종이 한장줌물건 받는사람한테 전화해서 시간맞춰 유스퀘어 가서 번호 말하고 찾아가라고 하면됨5시간 정도 소요서류 작은박스 9천원",2024-10-15
476637693,"질문서울신림동에서 광주유스퀘어버스터미널","고속버스택배로 보내는데 서울 어디서 보내야되나요ㅠㅜ","서울특별시 관악구 신림동 ",16,2024-10-15,4766376931,"하세요신림동에서 5413번이나 643버스를 타고센트럴시티터미널 에 가세요.1층 승차장쪽에 가시면 수화물 보내는곳이 있어여 ㅎㅎ",2024-10-15
476637479,"질문여의도 빌딩은 토탈 몇개 까지","님들 여의도 빌딩은 토탈 몇개 까지 말입니다 여의도가 뭡니까? 아시면 알려주세요 그리고 빌딩이 뭡니까? 아시면 알려주세요 그리고 토탈이 뭡니까? 아시면 알려주세요 그리고 몇개가 뭡니까? 아시면 알려주세요그리고 까지가 뭡니까? 아시면 알려주세요 그리고 여의도에 있는 빌딩은 토탈 몇개 까지 있습니까? 아시면 알려주세요","서울특별시 영등포구 여의도동 ",11,2024-10-15,NULL,NULL,NULL
476636819,"질문친구랑 서울 놀러가는데 할거 ㅊㅊ","16세 둘이서 서울로 갈껀데 저희가 진짜 활발해서 움직이는걸 좋아합니다 그리고 가격대는 너무 비싸지만 않으면 됩니당 시간도 많이 소비하지 않는걸로 짧게 여러 군데 갈거라서여 추천해주세영","서울특별시 ",55,2024-10-15,4766368192," : 광화문 종로 경복궁 창덕궁 종묘 명동 서대문형무소 국립중앙박물관 혜화동 대학로 잠실 롯데월드 석촌호수 서울숲 상암 하늘공원 여의도한강공원 여의도 더현대 서울 뚝섬유원지 동대문 신촌 홍대 코엑스 별마당도서관 올림픽공원 등이 있습니다.강남구 논현동에 위치한 유정식당 가볼만합니다",2024-10-17
476636819,"질문친구랑 서울 놀러가는데 할거 ㅊㅊ","16세 둘이서 서울로 갈껀데 저희가 진짜 활발해서 움직이는걸 좋아합니다 그리고 가격대는 너무 비싸지만 않으면 됩니당 시간도 많이 소비하지 않는걸로 짧게 여러 군데 갈거라서여 추천해주세영","서울특별시 ",55,2024-10-15,4766368191," 갈만한곳1호선용산역 아이파크몰용산역광장 큰길 차길건너편아모레퍼시픽 본사 무료 1층 지하 화장품 전시관 박물관 무료샘플 자판기 등용산우체국 옆 용리단길끝 삼각지역 전쟁기념관 무료신용산역 버스1정거장 도보15분 한강대교 중간 노들섬6호선이태원역1번출구 세계음식거리 클럽 바 골목4번출구 뒷골목 퀴논길 (이색적인 외국인거리 느낌 끝까지 걸으면 이태원시장 용산구청 )3번출구 이슬람 사원 쪽 맛집옆으로 나란히 외국인과 앉아서 밥 먹는 새로운 즐거움가격 5천 ~ 1만원 대우츄 라멘이태원 매운우동산카레라밥 (이색김밥 돈까스)녹사평역 2번출구 해방촌 경리단길 서로 마주보고 있음한강진역 3번출구 한남동 카페거리 블루스퀘어 1번출구 리움미술관미술관 뒤로 하얏트호텔 앞 남산순환도로 남산한강방향 뷰2호선성수역4번출구 팝업 거리펍지(PUBG) 게임 배틀그라운드 팝업 코닥코너샵 등 지도복합문화공간 무신사테라스 스테이지35 등3번출구 카페거리ate브런치 팅플래닛 등성수 2024년 10월 팝업리셀르노 3일 ~ 8일기타 2024년 10월 팝업용산역 아이파크몰 6층 짱구팝업10월31 일까지홍대입구역 산리오리러버스 클럽팝업 10월31일 까지여의도역 더현대 라인프렌즈 월드팝업스토어 10월14일 ~ 11월13일잠실역 레고90주년팝업 롯데월드몰 1층 10월21일 ~ 11월6일2호선건대입구역성수와 1정거장 동선코스 추천하며건대가 있어 홍대못지 않은 큰 번화가6번출구 커먼그라운드(복합문화공간)5번출구 양꼬치거리 1번출구 다이소앞 메인거리 초입1호선동대문역동선코스 동대문 동묘 낙산공원 대학로9번출구동대문 종합시장 옷상가 아님 소품 원단 악세서리 혼수 abcd동 (일요일 문닫음)d동 골목에 길거리 음식 10개 있고 청계천 방향 우측 좁은 골목에 닭한마리 골목 이라고있는데 닭한마리집은 몇개 없고 백반이 유명청계천 건너편으로 두타 밀리오레 쇼핑타운 이쪽이 낮저녁 소매 전문 ddp 쪽 쇼핑타운 새벽 도매전문두타 밀리오레 맞은편이 ddpddp 좌측 맥스타일 골목 에 일요일만 열리는 일요시장이곳이 1천원짜리 재고 하자있거나 반품된 새옷 티셔츠도 있고 각종 새물건 아주저렴 하게 파는곳동묘벼룩시장 하고 연계해서 보면 아주좋은 동선코스일요시장 길 쭉 따라가면 디오트 간판이 크게 보임 앞이 청계천 다리다리 건너면 동묘 벼룩시장(일요일이 아닐경우 동대문역 4번출구 완구문구 도매상가 골목 끝까지 가면 동묘연결)구제 상가 옷무덤 골동품 수입먹거리 등 중고 용품 파는곳동묘벼룩시장 구경 후 동묘앞역 10번 출구에서 03번 마을버스 타고낙산공원 종점 하차 5분 서울 뷰 를 보고성곽길 따라 내려오면 한양도성박물관 흥인지문 동대문역이화마을 쪽으로 내려오면 대학로 마로니에공원 혜화역2곳다 걸어서 내려오는 시간은 10분대학로 동대문에서 걸어올라가면 20분 정도 걸림(동묘구제시장 쇼핑방법 지하철출구 앞 구제메인거리 보다 동묘문앞 옷무덤(2천원짜리 쌓인옷)우측 골목구제가 싸고 오리지널 )동묘맛집 청계천 라인으로 나오면찾기 쉬움 바로뒷골목 동태찌개 골목이라고 함 매우좁은 골목 가게가 10개 정도 있음광주식당 한가지메뉴 동태찌개 줄서서먹는곳 8 돈까스 가게 1곳 83호선독립문역서대문형무소 보고 독립문사거리 에서 좌측 대각선으로 보면가장큰건물 경찰박물관 감옥체험 수갑체험 등 각종체험 과 신기한 전시물 무료뒷쪽길로 해서 돈의문박물관 마을까지 걸어서 갈수도 있음 15분 정도 소요맛집 영천시장5호선광화문역 서대문 역4번 출구 최근 가장 핫한 돈의문 박물관 마을 신라 조선 그런거 아님 70 ~ 90년대 생활사 박물관만화방 오락실 실제 체험 무료 광화문역 도보10분 광화문광장 교보문고 청계광장강남 역11번 출구 강남역 지하상가 200여개 매장리니게이트 팝업스토어 콜투마인드 팝업스토어 악세사리 폰 등 옷가게가 유명 10시 ~ 22시애플샵 cgv 뒤쪽골목에 방탈출 보드게임 등 이색까페 네컷사진 이 많은곳먹거리 꼬꼬이 일식 카레 디저트 빌리엔젤 1만원대8번 출구 삼성전자 딜라이트샵 무료10번출구 골목이 성인상권 이고 건너편 11번출구 cgv 쪽은 학생들 상권)중간 카카오프렌즈 3층 까페 음료 도넛 5천 ~ 3천뒤쪽 제로ㅇㄷ 방탈출까페 먹거리 강ㄴ교자 칼국수1만원대 콤보 샌드위치클럽 포차거리가장 끝 신논현역 교보문고4번 출구 직진 10분 kbo 회관 프로야구 정보 전시관 무료2호선삼성역코엑스몰 아쿠아리움별마당도서관 1층 2층 약7만권 책대여는 불가 하며 안에서만 가능 2층이 한가한편2호선잠실 역잠실역 지하상가 영업장 150개 옷가게 가장 많고 소품샵도 먾은곳4번 출구 롯데월드2번 출구 롯데타워롯데타워 뒤 석촌호수 동호송리단길 보드게임카페(청소년할인) 만화카페 소품샵거리 공방네컷사진 노래방 등 즐길 거리가 있는 곳소품샵코지블루비쥬마켓루이코모맛집세컨디포레스트 스파게티 1.5봉땅 꽈베기 4동경산책 일식 1.4일일향 중국집 1.13호선종로3가역익선동 인사동 북촌한옥마을 삼청동 경복궁 동선코스4번출구 편의점골목이 익선동 초입 옆에 지나가는 사람과 어깨가 닿을 정도로매우 좁은 미로같은 (겉만 한옥 거리이지 사실 속은 서양식 )까페 네컷사진 오락실 옷 가게 등 즐길거리 먹거리가 많은곳 바로옆 낙원상가통과하면 인사동 네거리 쌈지길(전통복합문화공간)방향 안국역 쪽 인사동 초입 1번출구 안국빌딩 골목진입정독도서관 옆길로 해서 목욕탕굴둑이 보이는 골목 언덕이 북촌한옥마을북촌한옥마을 난간계단으로 내려가면 삼청동 카페거리여기서 조금 가면 삼청파출소 우측으로보면 경복궁 담벽라 민속박물관 출구종로3가역 맛집 익선동 쪽을지면옥 냉면15 소고기국밥13종로찌게마을 대구탕12 2시간이상 못있는곳미갈매기살 갈매기살18 삽겹19 막창18이경문순대곱창 11시부터 줄 순대국 9 건더기 엄청푸짐종로할머니국수 멸치국물 8 김치가 괜찮은곳 찬양집 해물국물 하고 양대산맥베베도넛 4 음료5간판없는가게 스파게티 아란치니 8익선미다방 파스타 2서울커피 빵4.5 음료 6호호식당 일식 히레카츠 16자연도 소금빵 시간대별로 나오는빵을 먹을수 있는곳한옥마당 에서 차와 빵을 먹을수 있는곳 대신 차를 시켜야함 (익선동 카페구조가 대부분 비슷)소금빵 4개 한셋트 12 빵매니아 추천을지로 입구역8번 출구 바로앞 롯데백화점 연결통로스타 애비뉴 (연예인 bts 사진 손도장 등 포토존으로 유명 ) 롯데앞명동지하상가로 차 길 건너면 명동 을지로 초입명동 세계 길거리 음식 탕후루 등 (길거리 음식은 16시 이후에 많이 나옴)명동성당 옆골목이 맛집(명동교자등 ) 노래방 보세옷 등 놀 거리가 많은 곳명동역 쪽으로 나옴 명동역 지하상가 안 굿즈샵 1번 출구 12층짜리 다이소3번 출구 퍼시픽호텔 갈림길 좌측 재미로 끝까지 올라가면 남산돈까스 거리 (소월로)명동역 4번 출구 직진 신세계 사거리 좌측 애니메이션 센터 1층 애니까페 2층 놀이방애니센터에서 터널 방향으로 조금 올라가면 오르미라는 에스컬레이터 장치 무료남산타워 케이블카타는곳 까지 올라감명동은 물가가 비쌈 저렴한분식류등촌샤브샤브 칼국수 1명동교자 칼국수 1신세계떡복이두끼 떡복이 학생 1이베달라붙는떡복이 1영등포 역영등포 지하상가 영업장 120개 옷가게가 가장많으며 중고서점 알라딘 등 이색매장도 많음지하상가와 연결된 신세계 백화점백화점과 타임스퀘어 는 연결 내부 교보문고 오락실 실내동물원 옥상정원 등홍대입구역9번출구 kfc 골목 초입 길거리 음식 10개메뉴는 떡복이 순대 꼬치 . 등 3천 ~ 4천 .길거리음식 지나면 버스킹무대 앞좌측길은 ak프라자 뒷쪽 직진 좁은골목 서교초등학교 보세옷거리우측길 지나서 사거리 차길나옴건너편 분홍색 스티커사진 골목이 홍대메인거리바로옆 나이키 좁은 골목은 곱창음식 사주타로 골목좌측 홍대정문방향 으로는 브랜드 옷가게 들이 많음우측 홍대입구역 사거리 방향 (큰길)메인거리 진입 홍대자체 브랜드 청바지 1만5천원 빽바지 엠플레이그라운드 등 컨테이너 옷가게괜찮은 옷가게가 많이 있음 길거리에 저렴한 1천 ~ 2천 짜리 악세사리화장품가게 타로 운세가 굉장히 많고 폰가게 등등 중간에 수 노래방 본점끝쪽 길바닥에 색칠해놓은 광장같곳이 나옴 스피커 가져와서 모자 깔아놓고 혼자 춤 기타버스킹 하고 다름우측으로 력셔리 수 노래방 짱 오락실 상상마당상상마당 앞길은 가운데가 공영주차장 이었는데 전부 없애고 공원화양싸이로 상가 까페가 쭉 합정역 상수역까지 연결합정역쪽은 고기집이 많고 상수역쪽은 까페가 많음3번출구 연트럴파크 가운데가 공원 양싸이드로 상가가 쭉 있고우측 까페많은쪽 골목골목에 연남동 특유의 소품샵 이쁜까페 옷가게인스타 감성 디저트 가게가 즐비하고 연남동주민센터 쪽도 괜찮은곳 많음동진시장 연남동 골목골목 끝 쪽에 위치 금토일에 장이 열리며수제 향수 악세사리 등 옛날 시장을 개조한곳연트럴파크 중간 철길 건널목 우측에 기사식당 꽤유명 하고화교들이 직접운영하는 중국집이 몇개 있음연남동의 과거 모습은 기사식당 골목 이 있는 작은 화교마을연남동 끝 연희동 카페거리 넘어가는 굴다리 벽화 그려진 포토존홍익대학교 정문 우측바로옆길 포토존 벽화거리정문 좌측 골목 홍대에서 가장 높은 와우공원홍대정문에서 우측으로 5분정도 걸어가면 클럽포차거리삼거리포차 앞 기준 홍대 방향은 20대 클럽우측 상수역 방향은 30대 클럽2번출구 라인프렌즈 메가박스 삼성디지털프라자 무료포토존 cgv뒷쪽 카페들이 가격이 저렴 싼만큼 외진곳카페 길로 해서 연트럴파크로 갈수가 있음4번출구 ak프라자 꼭대기 홍대뷰 감상ak프라자 5층 굿즈샵 애니메이트3층짜리다이소 와이즈파크 타미야6번출구 소품샵거리 오브젝트 수바코책거리 굿즈샵 안서당8번출구 카카오프렌즈홍대놀거리 만화까페 1시간 + 음료 7천원 (보통 24시까지 영업 24시간 하는곳은 심야 요금 따로적용)방탈출까페 1인 2만5천원 60분 가격 낮아진곳 많음 메인거리 중간중간 피켓들고 사람이 서있음vr까페 70분 2 ~ 3만원동물까페룸까페 1만2천원포토존까페 4500원 ~ 1만원타로 5천원사격장 1만원양궁장 1만원짱오락실폰케이스 만드는곳 2인 2만원정도스티커사진 4천원홍대메인 거리끝 8층짜리 상상마당 안에 소품샵 코노 까페 등 전부 다있음안에 공방이많음 7천원 까페 독립영화관 전시회 많이함 유료 무료 둘다 있음상상마당 맞은편 올리브영 골목 핑크대문 쪽이 클럽골목상상 사거리 우측 대각선 편의점 이름이 라면도서관 봉지면을 100여개세계 라면을 책처럼 꺼내먹는방식 국내라면가격은 거의 비슷일본라면이 비쌈 미고랭 저렴 외국인이 상당히 많음홍대 노래방 평균 1시간 1만2천원수노래방 토일만 24시간 낮12시 ~ 16시 1인 2천ㅅ 노래방의 장점은 전층을 사용함 창문쪽이 방이므로 홍대거리가 훤히 보임 밖에 지나가는 사람보면서 노래를 부른다는거 물론 밖에서도 보임상상맞은편 낮시간 풀 1시간 4천원 노래방 이었는데 바꼈음 (19시 까지 청소년 8천원 성인1만원)메인거리 초입 우측 좁은골목 노래방 토일 제외 풀 성인1만 청소년8천원홍대에서 메인거리만 (nb대리점 청춘마루 나이키 )찾으면 전부 몰려있고 홍대에서 상상마당 쪽이 저렴홍대에는 스티커 사진관이 엄청 많은곳 50미터마다 한곳씩 보임 인생네컷 홍대네컷 하루필름 ... 등가성비 맛집9번출구 바로앞 길거리 음식 떡복이 순대 평범한곳 8개메인거리 초입 길거리음식 미니붕어빵 한봉지3 마카롱 3 홍콩 계란빵 3 닭꼬치 4.5 등조폭떡복이 5 9번출구 바로뒷골목만평우동 5.5 메인거리 중간 우측 골목철판볶음밥전문점 1 메인거리 사거리 우측카츠업 돈까스 1 메인거리 사거리 좌측 골목혼카츠 돈까스 1.1 메인거리 중간 좌측유선생 돈까스 1 클럽거리쪽가미우동 6 9번출구우동가조쿠 8 2번출구고토히라우동 9 7번출구이츠모라멘 9.5 9번출구부탄츄라멘 9 7번출구연남동 3번출구 기사식당 감남무집 불백1.2 반찬무한리필 화교운영 중국집 덕자한식 1서울 찐 맛집 정리광장시장 빈대떡남대문시장 칼국수청진동 해장국무교동 북어국충무로 생선구이신촌 서서갈비 형제 갈비왕십리 곱창경희대 파전동대입구역 태극당연남동 디저트 리치몬드 제과점여의도 나폴레옹 제과점남산중턱 남산돈까스이태원 수제버거명동 나라별 길거리음식노량진 컵밥동대문 길거리음식홍대 라멘신당동떡볶이신림동순대공덕동 장충동 족발",2024-10-15
476636453,"질문강동송파 고등학교","제가 성내2동이랑 천호 사이 어딘가쯤에 살고있는 중2학생인데요 부모님은 자사고에 가길 바라시는데 학원에서는 한대부고 이대부고 이런쪽을 가면 무조건 정시로 대학가야해서 안좋을거니까 가지말라합니다 그리고 일반고는 다 별로라고 해서 어디를 가야할지 잘 모르겠어요 잠실쪽은 특목고 자사고떨어진애들이 온다해서 어려워서 고등학교 4학년이라는 말도있던데 어디 고등학교를 진학하는게 제일 좋을까요? 사실 영파여고에 갈 확률이 정말정말 높은데 저는 사실 한영쪽 가고싶거든요 한영은 근데 여기서 잘 안보내준다고 하더라고요 어디가 제일 가능성이있고 나을까요?ㅜㅜ 전 영파여고에 절대 가고싶지않습니다ㅠ","서울특별시 송파구 ",14,2024-10-15,NULL,NULL,NULL
476636062,"질문각 지역역에 있는 문. 화 센터 수강.","수강하면 재미있나요?","서울특별시 강남역 ",17,2024-10-15,4766360621,"네  맞습니다2.최근에는 여러가지  프로그램이 있기 때문에  좋습니다3.나에게 맞는 수강 프로그램에  등록 합니다",2024-10-15
476635927,질문홍대...,"님들 홍대 말입니다 홍대가 뭡니까? 아시면 알려주세요","서울특별시 마포구 동교동 ",18,2024-10-14,4766359274,대학교홍대입구역,2024-10-15
476635927,질문홍대...,"님들 홍대 말입니다 홍대가 뭡니까? 아시면 알려주세요","서울특별시 마포구 동교동 ",18,2024-10-14,4766359273,"대학교 와 홍대입구 지하철역이 있는곳가장 놀기좋은 지역이 되면서 부터  (서교동 이 아닌) 놀기좋은 지역 대명사 홍대",2024-10-15
476635927,질문홍대...,"님들 홍대 말입니다 홍대가 뭡니까? 아시면 알려주세요","서울특별시 마포구 동교동 ",18,2024-10-14,4766359272,"대학교 줄임말",2024-10-15
476635927,질문홍대...,"님들 홍대 말입니다 홍대가 뭡니까? 아시면 알려주세요","서울특별시 마포구 동교동 ",18,2024-10-14,4766359271,대학교,2024-10-14
